,sno,complaint,complaint_description,complaint_type,recieved_date,incident_date,county,incident_status_desc,incident_zip,incident_closed_date
668,669,130443,Smoke from two indoor woodstoves from neighbor's house.,Air,2023-02-01,2023-02-01,Anne Arundel,Incident Closed - No further action,,2023-02-02
669,670,130442,Dust from sandblasting and odor and overspray from spray painting vehicles and vehicle parts.,Air,2023-02-01,2023-01-31,Frederick,Under Investigation,21757,
670,671,130441,Foul sulfur/fish odor in the air.,Air,2023-02-01,2023-01-31,Anne Arundel,Incident Closed-No Violation Observed,21060,2023-02-02
671,672,130438,concern of water damages in the apartment,Other,2023-01-31,2023-01-31,Prince George's,Incident Closed-Managed,,2023-02-01
672,673,130437,Concern of residue coming from neighbor's wood boiler stove,Other,2023-01-30,2023-01-30,Not Yet Determined,Incident Closed-Managed,,2023-02-01
673,674,130429,Burning asphalt odors,Odor,2023-01-29,,Baltimore,Incident Closed-No Violation Observed,,2023-02-02
674,675,130428,Open Burning,Open Burning,2023-01-30,2023-01-30,Washington,Referred to Outside Agency,21740,
675,676,130416,CO2 levels and PM levels high inside his residence.  He has contacted his condo. HOA.,Air,2023-01-26,2023-01-26,Anne Arundel,Incident Not Applicable to MDE,,
676,677,130413,Dust complaints received by MDE Solid Waste. Request to evaluate overall Air Quality compliance.,"Air, Fugitive Dust/Particulate Matter",2023-01-11,2023-01-11,Montgomery,Incident Closed - No further action,20833,2023-01-25
677,678,130412,Dust Concerns received by MDE Solid Waste Program. Evaluate overall Air Quality Compliance for the site.,"Air, Fugitive Dust/Particulate Matter",2022-12-22,2022-12-22,Montgomery,Incident Closed - No further action,20833,2023-01-25
678,679,130411,Smoke from neighbor's chimney.,Air,2023-01-25,2023-01-24,Anne Arundel,Incident Closed-No Violation Observed,,2023-01-25
679,680,130410,Smoke from neighbor's two wood burning stoves.,Air,2023-01-25,2023-01-24,Anne Arundel,Incident Closed - No further action,,2023-01-25
680,681,130407,Smoke coming into her house from her neighbor's two  indoor wood burning stoves.,Air,2023-01-24,2023-01-24,Anne Arundel,Incident Closed-No Violation Observed,21037,2023-01-24
681,682,130401,Smoke from burning leaves in yard.,Air,2023-01-23,2023-01-21,Anne Arundel,Incident Closed-Managed,21401,2023-01-24
682,683,130397,Odor Complaint,Odor,2023-01-19,2023-01-19,Baltimore City,Incident Closed - No further action,21224,2023-01-19
683,684,130396,Odor Complaint,Odor,2023-01-02,2023-01-02,Howard,Incident Closed - No further action,20723,2023-01-02
684,685,130391,"Smoke from open burning.  Also, neighbor's commercial truck is parked on the lawn next to the River.  Concern of oil leaking from the truck.",Air,2023-01-19,2023-01-18,Anne Arundel,Incident Closed-Managed,21122,2023-03-17
685,686,130382,Open burning,Open Burning,2023-01-12,2022-10-16,Caroline,Incident Closed-Managed,21629,2023-01-12
686,687,130378,"Foul odors emanating from West Coast Mushrooms in Rising Sun, Maryland.","Air, Odor",2023-01-10,2023-01-10,Cecil,Referred to LMA,21911,
687,688,130375,He smells an industrial odor in the residential neighborhood.,Odor,2023-01-12,2023-01-12,Baltimore City,Incident Closed-Managed,,2023-01-13
688,689,130374,He smells an industrial odor in the residential neighborhood.,Odor,2023-01-02,2023-01-02,Baltimore City,Incident Closed-Managed,,2023-01-13
689,690,130373,He smells an industrial odor in the residential neighborhood.,Odor,2022-12-30,2022-12-30,Baltimore City,Incident Closed-Managed,,2023-01-13
690,691,130372,He smells an industrial odor in the residential neighborhood.,Odor,2022-12-28,2022-12-28,Baltimore City,Incident Closed-Managed,,2023-01-13
691,692,130365,Industrial odor complaint in the Riverdale park,Other,2023-01-05,2023-01-05,Prince George's,Incident Closed-Managed,20737,2023-01-27
692,693,130364,concern of open burning in the area,Other,2023-01-10,2023-01-10,Prince George's,Incident Closed-Managed,20772,2023-01-13
693,694,130363,Home Builder is burning construction waste instead of properly disposing of the material. Also concerned with contamination of well water and soil.,"Air, Open Burning",2022-12-29,2022-12-29,Cecil,Referred to LMA,21901,
694,695,130355,Odors emanating from Curio.,Odor,2023-01-10,,Baltimore,Incident Closed-No Violation Observed,21093,2023-05-02
695,696,130342,Neighbor is operating an illegal diesel repair shop out of his home. The concerns are under investigation with Cecil County Zoning.,"Air, Other",2023-01-05,2023-01-05,Cecil,Referred to Outside Agency,21921,
696,697,130341,Neighboring farm has fertilizer deliveries that are making the complainant unwell.,Fumes,2023-01-08,,Baltimore,Referred to Outside Agency,,
697,698,130339,Neighbor removed lead paint from exterior of house causing paint chips on the ground throughout.,Other,2023-01-06,2023-01-06,Montgomery,Referred to LMA,20902,
698,699,130338,Concerned with West Coast Mushrooms operations. Recent meeting occurred in Rising Sun with community and local officials.,"Air, Odor",2023-01-05,2023-01-05,Cecil,Referred to LMA,21911,
699,700,130334,Soapy smell in the area,Other,2023-01-04,2023-01-04,Prince George's,Incident Closed-Managed,,2023-01-09
700,701,130333,Spray painting a bus in a yard two doors down from Complainant.,Air,2023-01-09,2023-01-06,Anne Arundel,Incident Closed-No Violation Observed,,2023-01-10
701,702,130332,"Bad air quality around Curtis Bay, Ordnance RD and near MVA in Glen Burnie",Air,2023-01-09,2023-01-05,Anne Arundel,Incident Closed-No Violation Observed,,2023-01-09
702,703,130331,Concern of loud boom noise,Other,2023-01-04,2023-01-04,Prince George's,Incident Closed-Managed,,2023-01-09
703,704,130330,Concern of boom noise and shaking of house Cheverly area,Other,2023-01-04,2023-01-09,Prince George's,Incident Closed-Managed,,2023-01-09
704,705,130329,concern of loud boom noise in Cheverly,Other,2023-01-05,2023-01-03,Prince George's,Incident Closed-Managed,20785,2023-01-09
705,706,130309,concern of dump truck activities,Other,2022-12-28,2022-12-28,Prince George's,Incident Closed-Managed,20613,2022-12-30
706,707,130308,Construction on road creating dust.,Fugitive Dust/Particulate Matter,2022-11-29,,Baltimore,Incident Closed-No Violation Observed,,2023-03-22
707,708,130307,Burning odors,Fumes,2022-12-29,,Baltimore,Incident Closed - No further action,,2023-01-10
708,709,130306,Coal-fired facilities creating a bad air quality day.  Complainant wants the facilities to be shutdown for today.,Air,2022-12-29,2022-12-29,Anne Arundel,Incident Closed - No further action,,2022-12-29
709,710,130303,Smoke from an outdoor hydroheater.,Air,2022-12-28,2022-12-27,Anne Arundel,Under Investigation,,
710,711,130297,Open burning of material which did not originate on site.,Open Burning,2022-12-21,2022-12-21,Dorchester,Referred to Enforcement/Compliance,21613,
711,712,130296,"Bad odors, worse than normal.",Odor,2022-12-27,2022-12-24,Worcester,Incident Closed-Managed,21811,2022-12-27
712,713,120299,Smoke from backyard fire pit.  Some yard waste materials being burned. The complaint was referred from the FCHD.  FCHD has sent two letters and has conducted 3 site inspections.,Air,2022-12-22,2022-12-21,Frederick,Under Investigation,21788,
713,714,120298,Smoke from neighbor's chimney.,Air,2022-12-22,2022-12-15,Anne Arundel,Incident Closed - No further action,,2022-12-22
714,715,120297,Elite Eco blasting sandblasting outside at a farm and by a stream.,Air,2022-12-22,2022-12-15,Frederick,Incident Closed - No further action,21704,2023-02-23
715,716,120296,Smoke,Smoke,2022-12-20,2022-12-20,Garrett,Incident Closed - No further action,21550,2024-01-31
716,717,120295,Open burning creating black smoke,Open Burning,2022-12-10,2022-12-10,Caroline,Incident Closed - No further action,21629,2022-12-15
717,718,120290,Something is falling from the sky and creating mounds of bacteria in complainant's yard.,Other,2022-12-16,,Baltimore,Referred to Outside Agency,,
718,719,120285,concern of illegal painting operation,Other,2022-12-14,2022-12-14,Prince George's,Incident Closed-Managed,20781,2023-02-17
719,720,120285,concern of illegal painting operation,Other,2022-12-14,2022-12-14,Prince George's,Incident Closed-Managed,,2023-02-17
720,721,120284,Concern of illegal painting operation.,Other,2022-12-14,2022-12-14,Prince George's,Incident Closed-Managed,,2022-12-16
721,722,120283,Concern of illegal painting operation,Other,2022-12-14,2022-12-14,Prince George's,Incident Closed-Managed,,2023-01-04
722,723,120281,concern of indoor air quality,Other,2022-12-14,2022-12-14,Prince George's,Incident Closed-Managed,,2022-12-16
723,724,120280,concern odor of burnt coffee in the Cheverly area,Other,2022-12-07,2022-12-07,Prince George's,Incident Closed-Managed,,2023-01-18
724,725,120276,He smells an industrial odor in the residential neighborhood.,Odor,2022-12-09,2022-12-09,Baltimore City,Incident Closed-Managed,,2022-12-14
725,726,120275,He smells an industrial odor in the residential neighborhood.,Odor,2022-12-05,2022-12-05,Baltimore City,Incident Closed-Managed,,2022-12-14
726,727,120274,He smells an industrial odor in the residential neighborhood.,Odor,2022-12-04,2022-12-04,Baltimore City,Incident Closed-Managed,,2022-12-14
727,728,120273,The cannabis dispensary is causing odor in the neighborhood.,Odor,2022-11-28,2022-11-28,Baltimore City,Incident Closed - No further action,,2022-12-14
728,729,120272,A contractor is renovating a business next door creating dust with no precautions.,Fugitive Dust/Particulate Matter,2022-11-30,2022-11-30,Baltimore City,Incident Closed-Managed,,2022-12-14
729,730,120271,He smells an industrial odor in the residential neighborhood.,Odor,2022-12-27,2022-11-27,Baltimore City,Incident Closed-Managed,,2022-12-14
730,731,120270,He smells an industrial odor in the residential neighborhood.,Odor,2022-12-23,2022-12-23,Baltimore City,Incident Closed-Managed,,2022-12-14
731,732,120268,He smells an industrial odor in the residential neighborhood.,Odor,2022-12-21,2022-11-21,Baltimore City,Incident Closed-Managed,,2022-12-14
732,733,120263,Leaking Fuel Tank,"Abandoned Drums/Tanks, Oil Release/Spill",2022-12-09,2022-12-09,Allegany,Referred to LMA,21502,
733,734,120262,Open Burning,Open Burning,2022-12-09,2022-12-09,Washington,Referred to Outside Agency,21783,
734,735,120257,Open burning creating black smoke.,Open Burning,2022-12-12,2022-12-11,Dorchester,Incident Closed-Managed,21835,2023-01-19
735,736,120254,Autobody-Improper Ventilation,Other,2022-11-29,2022-11-29,Washington,Incident Closed - No further action,21750,2024-01-31
736,737,120248,Illegal Autobody,Suspected Operation without Permit,2022-11-29,2022-11-29,Washington,Incident Closed - No further action,21750,2024-02-05
737,738,120238,Odor from material spread on farm field,Odor,2022-12-01,2022-12-01,Dorchester,Referred to Outside Agency,21613,
738,739,120235,Indoor air quality from heating and AC units,ARA AQCP non-regulated entity,2022-11-30,,Baltimore,Incident Closed - No further action,,2022-12-06
739,740,120231,Neighbor is burning rubber products,"Fumes, Open Burning",2022-11-29,2022-11-29,Cecil,Incident Closed - No further action,,2022-12-02
740,741,120227,Indoor air quality issues from heating and AC.,Other,2022-11-28,,Baltimore,Incident Not Applicable to MDE,,
741,742,120226,Open burning of landscaping business debris creating a nuisance.,Open Burning,2022-11-22,2022-11-22,Dorchester,Incident Closed-Managed,21613,2022-12-28
742,743,120225,concern of apartment after a fire outbreak,Other,2022-11-29,2022-11-29,Prince George's,Incident Closed-Managed,,2022-11-30
743,744,120223,Car engine shop is creating fumes,Fumes,2022-11-23,,Baltimore,Incident Closed - No further action,,2023-02-23
744,745,120219,Odor from a wood craft vendor at the Craft Fair.,Air,2022-11-28,2022-11-23,Anne Arundel,Incident Closed-No Violation Observed,,2022-11-28
745,746,120218,Freon releases from HVAC equipment.,Air,2022-11-28,2022-11-22,Anne Arundel,Incident Closed - No further action,21032,2022-11-28
746,747,120217,Odor from wood craft cutting inside building #12 at the Christmas Craft fair.,Air,2022-11-28,2022-11-22,Anne Arundel,Incident Closed-No Violation Observed,,2022-11-28
747,748,120216,Freon releases from HVAC equipment.,Air,2022-11-28,2022-11-21,Anne Arundel,Incident Closed - No further action,21032,2022-11-28
748,749,120215,Freon releases from HVAC equipment.,Air,2022-11-28,2022-11-21,Anne Arundel,Incident Closed - No further action,21032,2022-11-28
749,750,120214,Odor from burning trash creating a nuisance on a regular basis.,Odor,2022-11-23,2022-11-23,Dorchester,Incident Closed-No Violation Observed,21631,2022-11-29
750,751,120213,Car engine shop is creating fumes,Fumes,2022-11-22,,Baltimore,Incident Closed - No further action,,2023-02-23
751,752,120211,Odor Complaint,Odor,2022-11-11,2022-11-11,Dorchester,Incident Closed - No further action,21835,2022-11-11
752,753,120210,Smoke and chemical odor,Odor,2022-11-18,2022-11-18,Queen Anne's,Incident Closed - No further action,21658,2022-11-21
753,754,120209,bad odors,Odor,2022-11-16,2022-11-16,Dorchester,Incident Closed-No Violation Observed,21643,2022-11-18
754,755,120207,Concerned with the amount of lawn care equipment operated by company. Odors related to fuel.,"Air, Fumes, Odor",2022-11-17,2022-11-17,Montgomery,Referred to Outside Agency,,
755,756,120205,Caller described dust escaping from top of baghouse of lime silo at DAP Products during lime delivery.,Fugitive Dust/Particulate Matter,2022-11-01,2022-10-31,Baltimore,Incident Closed-Managed,21219,2024-01-04
756,757,120204,Mold/ mildew inside home,"Air, Other",2022-11-16,2022-11-16,Montgomery,Incident Closed - No further action,,2022-11-18
757,758,120201,He smells an industrial odor in the residential neighborhood.,Odor,2022-11-11,2022-11-11,Baltimore City,Incident Closed-Managed,,2022-11-17
758,759,120200,He smells an industrial odor in the residential neighborhood.,Odor,2022-11-10,2022-11-10,Baltimore City,Incident Closed-Managed,,2022-11-17
759,760,120199,He smells an industrial odor in the residential neighborhood.,Odor,2022-11-06,2022-11-06,Baltimore City,Incident Closed-Managed,,2022-11-17
760,761,120198,He smells an industrial odor in the residential neighborhood.,Odor,2022-11-05,2022-11-05,Baltimore City,Incident Closed-Managed,,2022-11-17
761,762,120197,He smells an industrial odor in the residential neighborhood.,Odor,2022-11-04,2022-11-04,Baltimore City,Incident Closed-Managed,,2022-11-17
762,763,120190,Smoke from open burning reaching homeowner's residence.,Air,2022-11-16,2022-11-15,Anne Arundel,Incident Closed - No further action,,2022-11-16
763,764,120189,Dust from cutting masonry bricks without wet suppression.,Air,2022-11-16,2022-11-15,Frederick,Incident Closed - No further action,,2022-11-16
764,765,120188,Severe odors emanating from Kilby Farm,"Air, Odor",2022-11-08,2022-11-08,Cecil,Referred to Outside Agency,21917,
765,766,120186,Severe odors emanating from Kilby Farm in Rising Sun,"Air, Odor",2022-11-06,2022-11-06,Cecil,Referred to Outside Agency,21917,
766,767,120184,Exhaust fumes from tractor trailer right next to home.,Fumes,2022-11-10,2022-11-10,Dorchester,Referred to Outside Agency,21659,
767,768,120183,Dust from crushing & screening from Tolson Rubblefill.  Residence in close proximity to activity.  Requests activity to be moved to different location at site and to  plant some evergreen trees.,Air,2022-11-14,2022-11-14,Anne Arundel,Incident Closed-No Violation Observed,,2022-11-15
768,769,120179,Odor of burning tires,Odor,2022-11-09,,Baltimore,Incident Closed - No further action,,2022-11-15
769,770,120178,Car engine shop is creating fumes.,Fumes,2022-11-09,,Baltimore,Incident Closed - No further action,21222,2023-02-23
770,771,120175,Neighbor burning leaves too close to other homes.,Open Burning,2022-11-07,2022-11-07,Somerset,Incident Closed-No Violation Observed,21817,2022-11-08
771,772,120172,Chemical odor inside her house.,Air,2022-11-08,2022-11-07,Frederick,Incident Closed-No Violation Observed,,2022-11-10
772,773,120170,Dark smoke from open burning in yard.,Air,2022-11-07,2022-11-07,Anne Arundel,Under Investigation,,
773,774,120168,concern of visible emission from a burger king restaurant,Other,2022-10-28,2022-10-28,Howard,Incident Closed-Managed,,2022-11-07
774,775,120167,"Concerned with practices at site, including a specific adhesive used","Air, Other",2022-10-25,2022-10-25,Carroll,Incident Closed-Managed,21074,2022-11-09
775,776,120164,Dust from sandblasting and spray painting vehicles at the Grables Commercial Painting.,Air,2022-11-04,2022-11-03,Frederick,Under Investigation,,
776,777,120163,Dust from sandblasting and painting vehicles at Grables Commercial Painting.,Air,2022-11-04,2022-11-04,Frederick,Under Investigation,,
777,778,120158,"Smoke from open burning of trash, other items in yard.",Air,2022-11-03,2022-11-02,Anne Arundel,Under Investigation,,
778,779,120157,Unknown.  Called/no answer.,Air,2022-11-03,2022-10-26,Anne Arundel,Incident Closed-No Violation Observed,,2022-11-03
779,780,120156,Smoke from neighbor's wood burning stove.,Air,2022-11-03,2022-10-20,Frederick,Incident Closed - No further action,,2022-11-03
780,781,120155,Very strong sulfur odor in the area around American Yeast.,Odor,2022-09-27,2022-09-27,Baltimore,Incident Closed-Managed,21222,2022-09-27
781,782,120152,He smells an industrial odor in the residential neighborhood.,Odor,2022-10-30,2022-10-30,Baltimore City,Incident Closed-Managed,,2022-11-02
782,783,120151,He smells an industrial odor in the residential neighborhood.,Odor,2022-10-29,2022-10-29,Baltimore City,Incident Closed-Managed,,2022-11-02
783,784,120149,He smells an industrial odor in the residential neighborhood.,Odor,2022-10-22,2022-10-22,Baltimore City,Incident Closed-Managed,,2022-11-02
784,785,120148,He smells an industrial odor in the residential neighborhood.,Odor,2022-10-21,2022-10-21,Baltimore City,Incident Closed-Managed,,2022-11-02
785,786,120147,Company (DPS Automotive) is spray painting vehicles at their facility and paint fumes are being released into the air.,"Air, Fumes, Odor",2022-10-27,2022-10-27,Montgomery,Incident Closed-Managed,20852,2023-04-27
786,787,120146,Mold remediation occurred and wants an inspection to verify all has been removed.,ARA AQCP non-regulated entity,2022-10-21,2022-10-21,Baltimore City,Incident Closed - No further action,,2022-11-02
787,788,120145,He smells an industrial odor in the residential neighborhood.,Odor,2022-10-16,2022-10-16,Baltimore City,Incident Closed-Managed,,2022-11-02
788,789,120144,He smells an industrial odor in the residential neighborhood.,Odor,2022-10-15,2022-10-15,Baltimore City,Incident Closed-Managed,,2022-11-02
789,790,120143,He smells an industrial odor in the residential neighborhood.,Odor,2022-10-14,2022-10-14,Baltimore City,Incident Closed-Managed,,2022-11-02
790,791,120142,He smells an industrial odor in the residential neighborhood.,Odor,2022-10-12,2022-10-12,Baltimore City,Incident Closed-Managed,,2022-11-02
791,792,120141,He smells an industrial odor in the residential neighborhood.,Odor,2022-10-11,2022-10-11,Baltimore City,Incident Closed-Managed,,2022-11-02
792,793,120140,Burning plastics in a fire pit and creating a nuisance.,Open Burning,2022-11-01,2022-10-31,Worcester,Incident Closed-No Violation Observed,21851,2022-11-01
793,794,120138,Request for information,Other,2022-10-28,,Not Yet Determined,Incident Not Applicable to MDE,,
794,795,120137,Cement van creating dust?,Fugitive Dust/Particulate Matter,2022-10-28,,Not Yet Determined,Incident Closed-Managed,,2022-11-01
795,796,120134,Dust from dragging race track without water,Fugitive Dust/Particulate Matter,2022-10-24,2022-10-22,Worcester,Incident Closed-Managed,21851,2022-11-02
796,797,120134,Dust from dragging race track without water,Fugitive Dust/Particulate Matter,2022-10-24,2022-10-22,Worcester,Incident Closed-Managed,21851,2022-11-02
797,798,120119,Cinnamon and Cumin odors in Timonium.,Odor,2022-10-21,,Baltimore,Incident Closed - No further action,,2022-10-24
798,799,120110,Smoke from open burning,Air,2022-10-20,2022-10-19,Anne Arundel,Incident Closed-Managed,,2022-10-20
799,800,120109,Indoor air concerns.,Air,2022-10-20,2022-10-18,Anne Arundel,Incident Closed-No Violation Observed,,2022-10-20
800,801,120108,Open burning,Smoke,2022-10-19,,Harford,Incident Closed - No further action,,2022-10-20
801,802,120107,Venting freon,Air Pollutant Release,2022-10-18,,Harford,Referred to Outside Agency,21050,
802,803,120104,concerns of open burning and lotsa work on cars,Other,2022-10-17,2022-10-17,Prince George's,Incident Closed-Managed,,2022-10-19
803,804,120102,Smoke from crematory stack,Smoke,2022-10-17,2022-10-15,Baltimore,Incident Closed-No Violation Observed,21228,2022-11-01
804,805,120101,Dust from builder,Fugitive Dust/Particulate Matter,2022-10-14,,Baltimore,Incident Closed-No Violation Observed,,2022-10-19
805,806,120100,Dust from sandblasting vehicles.,Air,2022-10-17,2022-10-17,Frederick,Under Investigation,,
806,807,120088,Painting without a booth,Other,2022-10-07,,Baltimore,Incident Closed-No Violation Observed,21030,2022-10-12
807,808,120085,Refrigerant release,Air Pollutant Release,2022-10-07,,Baltimore,Referred to Outside Agency,,
808,809,120082,Auto body shop being operated out of residence. The site is paint spraying vehicles.,"Air, Fumes, Odor",2022-09-15,2022-09-15,Carroll,Referred to Outside Agency,21797,
809,810,120080,He has a question about a mold report.,ARA AQCP non-regulated entity,2022-10-06,2022-10-06,Baltimore City,Incident Closed - No further action,,2022-10-07
810,811,120078,Neighbor is using an outdoor grill in an enclosed patio causing smoke to be created between 10PM  3AM.,Smoke,2022-09-30,2022-09-30,Baltimore City,Incident Closed-Managed,,2022-10-07
811,812,120077,He smells an industrial odor in the residential neighborhood.,Odor,2022-09-30,2022-09-30,Baltimore City,Incident Closed-Managed,,2022-10-07
812,813,120076,Neighbor is using an outdoor grill in an enclosed patio causing smoke to be created between 10PM  3AM.,Smoke,2022-09-28,2022-09-28,Baltimore City,Incident Closed-Managed,,2022-10-07
813,814,120075,He smells an industrial odor in the residential neighborhood.,Odor,2022-09-21,2022-09-21,Baltimore City,Incident Closed-Managed,,2022-10-07
814,815,120074,He smells an industrial odor in the residential neighborhood.,Odor,2022-09-17,2022-09-17,Baltimore City,Incident Closed-Managed,,2022-10-07
815,816,120071,Smoke from burning yard brush in fire in neighbor's yard.,Air,2022-10-07,2022-10-06,Anne Arundel,Incident Closed-Managed,,2022-10-13
816,817,120067,Company is improperly disposing of refrigerants. Employees do not have required refrigerant certifications.,"Air, Air Pollutant Release",2022-10-03,2022-10-03,Carroll,Referred to Outside Agency,21048,
817,818,120066,Roofing dust/ material inside home from skylight install. Concerned with type of material in dust.,"Air, Fugitive Dust/Particulate Matter",2022-10-05,2022-10-05,Montgomery,Incident Closed - No further action,,2022-10-05
818,819,120058,Complainant detects odor inside his house.,Air,2022-10-03,2022-09-28,Anne Arundel,Incident Closed-No Violation Observed,,2022-10-03
819,820,120057,Smoke from truck driving on road. Smoke can be detected from their property.,Air,2022-10-03,2022-09-28,Frederick,Incident Closed - No further action,,2022-10-03
820,821,120056,Dust from sandblasting and solvent odor creating a nuisance off site.,Fugitive Dust/Particulate Matter,2022-09-29,2022-09-29,Wicomico,Incident Closed-No Violation Observed,21801,2022-10-04
821,822,120049,Neighbor is burning,Fumes,2022-09-28,,Baltimore,Incident Closed-Managed,,2022-09-29
822,823,120048,Neighbor is open burning.,Fumes,2022-09-27,,Baltimore,Incident Closed-Managed,,2022-09-28
823,824,120047,Lead Paint,Lead Paint Poisoning Complaint,2022-09-16,2022-09-16,Washington,Referred to LMA,21740,
824,825,120043,Open Burning,Open Burning,2022-09-15,2022-09-15,Garrett,Incident Closed - No further action,,2022-09-27
825,826,120042,Blasting rocks in the field next to 5929 Meadow Road.  Medical facilities to be built. Water suppression started to be used last week.  Dust issue began in August of 2022,Air,2022-09-26,2022-09-26,Frederick,Incident Closed-No Violation Observed,,2022-10-06
826,827,120040,Fugitive dust from a nearby construction site.,Fugitive Dust/Particulate Matter,2022-09-23,,Harford,Incident Closed-No Violation Observed,,2022-09-26
827,828,120037,concern of air conditioner use in Howard county public school,Other,2022-09-21,2022-09-21,Howard,Incident Closed-Managed,,2022-09-26
828,829,120036,Neighbor is cleaning their roof,Fumes,2022-09-23,,Baltimore,Incident Closed-Managed,,2022-09-23
829,830,110035,Water Supply Contamination,Drinking Water,2022-09-14,2022-09-14,Allegany,Referred to WMA,21502,
830,831,110033,Dust from sandblasting.  Sanding vehicle inside building.  Dust exiting building and creating dust cloud outside.,Air,2022-09-22,2022-09-22,Frederick,Incident Closed-Managed,,2022-09-22
831,832,110032,Painting outside.,Other,2022-09-20,,Baltimore,Incident Closed-Managed,21220,2022-10-04
832,833,110031,Dust from sandblasting.  Vehicle sandblasted inside of building and dust going outside.,Air,2022-09-22,2022-09-21,Frederick,Incident Closed-Managed,,2022-09-22
833,834,110029,He smells an industrial odor in the residential neighborhood.,Odor,2022-09-16,2022-09-16,Baltimore City,Incident Closed-Managed,,2022-09-20
834,835,110028,He smells an industrial odor in the residential neighborhood.,Odor,2022-09-12,2022-09-12,Baltimore City,Incident Closed-Managed,,2022-09-20
835,836,110027,He smells an industrial odor in the residential neighborhood.,Odor,2022-09-11,2022-09-11,Baltimore City,Incident Closed-Managed,,2022-09-20
836,837,110026,He smells an industrial odor in the residential neighborhood.,Odor,2022-09-10,2022-09-10,Baltimore City,Incident Closed-Managed,,2022-09-20
