,sno,complaint,complaint_description,complaint_type,recieved_date,incident_date,county,incident_status_desc,incident_zip,incident_closed_date
1011,1012,79377,Neighbor farm is spreading lime on the field creating visible emissions.,Fugitive Dust/Particulate Matter,2022-04-14,2022-04-14,Calvert,Incident Closed-Managed,,2022-04-20
1012,1013,79376,He smells an industrial odor in the residential neighborhood.,Odor,2022-04-13,2022-04-13,Baltimore City,Incident Closed-Managed,,2022-04-20
1013,1014,79375,He smells an industrial odor in the residential neighborhood.,Odor,2022-04-12,2022-04-12,Baltimore City,Incident Closed-Managed,,2022-04-20
1014,1015,79374,He smells an industrial odor in the residential neighborhood.,Odor,2022-04-11,2022-04-11,Baltimore City,Incident Closed-Managed,,2022-04-20
1015,1016,79373,He smells an industrial odor in the residential neighborhood.,Odor,2022-04-06,2022-04-06,Baltimore City,Incident Closed-Managed,,2022-04-20
1016,1017,79371,He smells an industrial odor in the residential neighborhood.,Odor,2022-04-05,2022-04-05,Baltimore City,Incident Closed-Managed,,2022-04-20
1017,1018,79370,He smells an industrial odor in the residential neighborhood.,Odor,2022-04-04,2022-04-04,Baltimore City,Incident Closed-Managed,,2022-04-20
1018,1019,79369,She has furniture with mold.,ARA AQCP non-regulated entity,2022-04-01,2022-04-01,Baltimore City,Incident Closed - No further action,,2022-04-20
1019,1020,79368,"He is hearing a humming noise, wants someone to inspect the area.",Noise Complaint,2022-04-01,2022-04-01,Baltimore City,Incident Closed - No further action,,2022-04-20
1020,1021,79364,Smoke from open burning of leaves.,Air,2022-04-19,2022-04-14,Anne Arundel,Incident Closed - No further action,,2022-04-19
1021,1022,79363,"Smoke from open burning of yard waste debris, tree branches, leaves.",Air,2022-04-19,2022-04-14,Anne Arundel,Incident Closed - No further action,,2022-04-19
1022,1023,79362,"Smoke from open burning of trash, boxes, plastic & cans.",Air,2022-04-19,2022-04-14,Anne Arundel,Incident Closed - No further action,21061,2022-04-29
1023,1024,79361,Dust or opacity observed from direction of facilities and covering over the RT. 70 highway in Frederick.,Air,2022-04-19,2022-04-12,Frederick,Incident Closed-Managed,,2022-04-19
1024,1025,79360,Sandblasting dust at the Grables Paint Shop.,Air,2022-04-19,2022-04-12,Frederick,Referred to Attorney General's Office,,
1025,1026,79359,Indoor air quality/odor inside the Heritage Harbor Recreation Center.,Air,2022-04-19,2022-04-11,Anne Arundel,Incident Not Applicable to MDE,,
1026,1027,79358,Dust or opacity cloud observed from the direction of facilities and over RT. 70 highway.,Air,2022-04-19,2022-04-11,Frederick,Incident Closed - No further action,,2022-04-19
1027,1028,79355,Noise,Noise Complaint,2022-04-13,2022-04-13,Harford,Incident Not Applicable to MDE,,
1028,1029,79343,Spray painting in neighbor's shed,Other,2022-04-14,2022-04-14,Prince George's,Under Investigation,20707,
1029,1030,79337,facility painting without paint booth,Other,2022-04-07,2022-04-07,Prince George's,Incident Closed-Managed,,2022-06-08
1030,1031,79336,painting without paint booth,Other,2022-04-07,2022-04-07,Prince George's,Incident Closed-Managed,,2022-08-19
1031,1032,79334,painting without a paint booth,Other,2022-04-07,2022-04-07,Prince George's,Incident Closed-Managed,,2022-06-08
1032,1033,79333,Town of Manchester referral. Inquiring about requirements of hemp pharmacy manufacturing.,"Air, Fumes, Odor",2022-04-01,2022-04-01,Carroll,Incident Closed-Managed,21102,2022-04-15
1033,1034,79324,Odor coming from Honeygo Reclamation Center,Odor,2022-04-11,,Baltimore,Incident Closed-No Violation Observed,21128,2022-04-14
1034,1035,79322,Work w/o Permits or Approval,Other,2022-04-05,2022-04-05,Allegany,Referred to WMA,,
1035,1036,79311,Concerns regarding neighbor spraying herbicides.,"Agricultural, Air",2022-04-01,2022-04-01,Carroll,Referred to Outside Agency,21074,
1036,1037,79310,Unknown,Other,2022-04-04,,Baltimore,Incident Closed - No further action,,2022-04-14
1037,1038,79309,Outdoor Wood Burner,Smoke,2022-03-30,2022-03-30,Washington,Incident Closed - No further action,,2022-04-05
1038,1039,79308,Open Burning,Open Burning,2022-03-27,,Washington,Incident Closed-Managed,21742,2022-06-21
1039,1040,79297,Noise in between walls inside his house.,Air,2022-04-04,2022-04-01,Anne Arundel,Incident Closed - No further action,,2022-04-04
1040,1041,79296,Mold,Air,2022-04-04,2022-04-01,Anne Arundel,Incident Not Applicable to MDE,,
1041,1042,79288,Fugitive dust,Fugitive Dust/Particulate Matter,2022-03-25,,Harford,Incident Closed-No Violation Observed,21085,2022-04-06
1042,1043,79284,Concern of exhaust pipe near window,Other,2022-03-30,2022-03-30,Prince George's,Incident Closed-Managed,,2022-03-30
1043,1044,79265,Question re air quality,Air,2022-03-24,,Baltimore,Incident Closed-Managed,,2022-03-28
1044,1045,79264,Neighboring farmer is burning plastics from his field.,Fumes,2022-03-25,2022-03-25,Baltimore,Referred to Outside Agency,,
1045,1046,79260,Smoke from chimney stack at the warehouse.  Dumpsters outside.  Concern of types of materials being burned.,Air,2022-03-25,2022-03-23,Charles,Referred to LMA,20601,
1046,1047,79259,Smoke from firepit open burning.,Air,2022-03-25,2022-03-23,Anne Arundel,Incident Closed - No further action,,2022-04-06
1047,1048,79254,He smells an industrial odor in the residential neighborhood.,Odor,2022-03-18,2022-03-18,Baltimore City,Incident Closed-Managed,,2022-03-24
1048,1049,79253,He smells an industrial odor in the residential neighborhood.,Odor,2022-03-17,2022-03-17,Baltimore City,Incident Closed-Managed,,2022-03-24
1049,1050,79252,He smells an industrial odor in the residential neighborhood.,Odor,2022-03-16,2022-03-16,Baltimore City,Incident Closed-Managed,,2022-03-24
1050,1051,79251,He smells an industrial odor in the residential neighborhood.,Odor,2022-03-11,2022-03-11,Baltimore City,Incident Closed-Managed,,2022-03-24
1051,1052,79250,He smells an industrial odor in the residential neighborhood.,Odor,2022-03-15,2022-03-15,Baltimore City,Incident Closed-Managed,,2022-03-24
1052,1053,79249,He smells an industrial odor in the residential neighborhood.,Odor,2022-03-09,2022-03-09,Baltimore City,Incident Closed-Managed,,2022-03-24
1053,1054,79244,concern of exhaust pipe in apartment,Other,2022-03-21,2022-03-21,Prince George's,Under Investigation,,
1054,1055,79240,Smoke from neighbor's backyard firepit.,Air,2022-03-23,2022-03-21,Anne Arundel,Incident Closed - No further action,,2022-03-23
1055,1056,79238,Mold issues inside her apartment.,Air,2022-03-23,2022-03-18,Anne Arundel,Incident Not Applicable to MDE,,
1056,1057,79229,Exhaust pipe affecting tenant,Other,2022-03-15,2022-03-15,Prince George's,Referred to Outside Agency,,
1057,1058,79225,Complainant detects industrial odor and alleges Valley Protein.,Air,2022-03-17,2022-03-17,Anne Arundel,Incident Closed-No Violation Observed,,2022-03-21
1058,1059,79213,Dust particles from sandblasting.,Fugitive Dust/Particulate Matter,2022-03-14,2022-03-14,Wicomico,Under Investigation,21801,
1059,1060,79209,Odor from Burning Used Oil,Odor,2022-03-07,,Allegany,Incident Closed-Managed,21532,2022-06-21
1060,1061,79208,Spray Painting and Moving Heavy Equipment,Other,2022-03-03,,Washington,Referred to WMA,21713,
1061,1062,79207,Black Smoke and the smell of Aluminum that happens periodically.,"Odor, Smoke",2022-03-11,2022-03-10,Cecil,Under Investigation,21921,
1062,1063,79205,He smells an industrial odor in the residential neighborhood.,Odor,2022-03-08,2022-03-08,Baltimore City,Incident Closed-Managed,,2022-03-10
1063,1064,79204,He smells an industrial odor in the residential neighborhood.,Odor,2022-03-05,2022-03-05,Baltimore City,Incident Closed-Managed,,2022-03-10
1064,1065,79202,Odor in Neighborhood around plant,Odor,2022-02-17,2022-02-17,Frederick,Incident Closed-Managed,21777,2022-03-10
1065,1066,79201,Complainant wants his indoor air tested.,Air,2022-03-07,,Baltimore,Incident Not Applicable to MDE,,
1066,1067,79200,Smoke from neighbor's outdoor furnace.,Air,2022-03-09,2022-03-07,Frederick,Incident Closed - No further action,,2022-03-17
1067,1068,79199,Burning leaves and grass.,Air,2022-03-09,2022-03-07,Anne Arundel,Incident Closed - No further action,,2022-04-06
1068,1069,79174,Neighbor has a van with signs that say radioactive on the side of it in front of his house.,"Other, Radiological Health Complaint",2022-03-03,2022-03-03,Baltimore,Incident Closed-Managed,,2022-03-04
1069,1070,79168,Mold/mildew in apartment.,Air,2022-03-03,2022-03-03,Anne Arundel,Incident Not Applicable to MDE,,
1070,1071,79167,Concerns regarding dust caused by brick repointing on the exterior of building.,"Air, Fugitive Dust/Particulate Matter",2022-03-01,2022-03-01,Montgomery,Referred to Outside Agency,20902,
1071,1072,79165,He smells an industrial odor in the residential neighborhood.,Odor,2022-03-01,2022-03-01,Baltimore City,Incident Closed-Managed,,2022-03-02
1072,1073,79164,That there is burning related odor in the Harmony Court area.,Odor,2022-02-16,2022-02-16,Baltimore City,Incident Closed - No further action,,2022-03-02
1073,1074,79163,He smells an industrial odor in the residential neighborhood.,Odor,2022-02-21,2022-02-21,Baltimore City,Incident Closed-Managed,,2022-03-02
1074,1075,79158,A large boom noise in the Cheverly  area.,Other,2022-02-27,2022-02-27,Prince George's,Referred to Outside Agency,,
1075,1076,79156,About 100 helium balloons were released into the atmosphere.,Air,2022-02-28,2022-02-22,Anne Arundel,Referred to LMA,21146,
1076,1077,79155,Open burning vinyl siding,Open Burning,2022-02-22,2022-02-21,Dorchester,Incident Closed-Managed,21613,2022-02-23
1077,1078,79154,Company is painting/priming steel I-beams outside,Other,2022-02-22,2022-02-21,Dorchester,Incident Closed-No Violation Observed,21613,2022-02-25
1078,1079,79145,Odor Complaint,Odor,2022-02-16,2022-02-16,Dorchester,Incident Closed - No further action,21835,2022-02-16
1079,1080,79144,Odor Complaint,Odor,2022-02-11,2022-02-11,Dorchester,Incident Closed - No further action,21835,2022-02-11
1080,1081,79143,Odor Complaint,Odor,2022-02-09,2022-02-09,Dorchester,Incident Closed - No further action,21835,2022-02-09
1081,1082,79142,Odor Complaint,Odor,2022-02-03,2022-02-03,Dorchester,Incident Closed - No further action,21835,2022-02-03
1082,1083,79141,Odor Complaint,Odor,2022-02-03,2022-02-03,Dorchester,Incident Closed - No further action,21835,2022-02-03
1083,1084,79136,Dust that contains silica material coming from concrete plant,Fugitive Dust/Particulate Matter,2022-02-18,2022-02-17,Queen Anne's,Incident Closed-No Violation Observed,21658,2022-02-18
1084,1085,79134,He smells an industrial odor in the residential neighborhood.,Odor,2022-02-16,2022-02-16,Baltimore City,Incident Closed-Managed,,2022-02-18
1085,1086,79133,There is a ship off loading cement which is causing dust to drop on cars below.,Fugitive Dust/Particulate Matter,2022-02-15,2022-02-15,Baltimore City,Incident Closed-No Violation Observed,,2022-03-08
1086,1087,79132,He smells an industrial odor in the residential neighborhood.,Odor,2022-02-11,2022-02-11,Baltimore City,Incident Closed-Managed,,2022-02-18
1087,1088,79131,He smells an industrial odor in the residential neighborhood.,Odor,2022-02-09,2022-02-09,Baltimore City,Incident Closed-Managed,,2022-02-18
1088,1089,79130,He smells an industrial odor in the residential neighborhood.,Odor,2022-02-07,2022-02-07,Baltimore City,Incident Closed-Managed,,2022-02-18
1089,1090,79129,Complaint forwarded from EPA Region 3 regarding various concerns at Ritchie Brothers Auctioneers,Air,2022-02-17,2022-02-03,Cecil,Referred to LMA,21901,
1090,1091,79129,Complaint forwarded from EPA Region 3 regarding various concerns at Ritchie Brothers Auctioneers,Air,2022-02-17,2022-02-03,Cecil,Referred to LMA,21901,
1091,1092,79127,Air quality in apartment building.,Other,2022-02-16,,Baltimore,Incident Not Applicable to MDE,,
1092,1093,79125,complaint not given,Other,2022-02-16,2022-02-16,Howard,Incident Closed-Managed,,2022-02-18
1093,1094,69124,Mold/mildew within her condominium and effecting their health.  Their facilities has sprayed to try to rid the mold.,Air,2022-02-17,2022-02-17,Not Yet Determined,Incident Closed - No further action,,2022-02-17
1094,1095,69123,"Poor air quality and odor in the vicinity of the MVA, 21060 and Brooklyn Park, 21225 .",Air,2022-02-17,2022-02-17,Anne Arundel,Incident Closed-No Violation Observed,,2022-02-28
1095,1096,69122,"Burning tire odor near 6413 Davis Road, residential area.",Air,2022-02-17,2022-02-11,Frederick,Incident Closed-No Violation Observed,,2022-02-17
1096,1097,69118,Odor Complaint,Odor,2022-02-03,2022-02-03,Baltimore City,Incident Closed - No further action,,2022-02-03
1097,1098,69117,Odor Complaint,Odor,2022-01-30,2022-01-30,Baltimore City,Incident Closed - No further action,,2022-01-30
1098,1099,69116,Odor Complaint,Odor,2022-01-27,2022-01-27,Baltimore City,Incident Closed - No further action,,2022-01-27
1099,1100,69115,Odor Complaint,Odor,2022-01-08,2022-01-08,Baltimore City,Incident Closed - No further action,,2022-01-08
1100,1101,69114,Odor Complaint,Odor,2022-01-06,2022-01-05,Baltimore City,Incident Closed - No further action,,2022-01-05
1101,1102,69108,Strong odor in Cheverly area,Other,2022-02-11,2022-02-11,Prince George's,Incident Closed-Managed,,2022-03-09
1102,1103,69104,Fumes from neighbor painting cars,Fumes,2022-02-11,,St. Mary's,Incident Closed-No Violation Observed,,2022-02-15
1103,1104,69101,Emissions from crematory stack for one minute.,Air,2022-02-11,2022-02-09,Charles,Incident Closed-Managed,,2022-02-10
1104,1105,69098,Mud and dirt on road,Other,2022-02-02,,Baltimore,Incident Closed-No Violation Observed,,2022-02-10
1105,1106,69090,Indoor Air Quality,Other,2022-02-07,2022-02-07,Allegany,Referred to Outside Agency,21521,
1106,1107,69088,Indoor Air Quality,Other,2022-02-04,2022-02-04,Allegany,Incident Not Applicable to MDE,,
1107,1108,69087,Excessive black smoke and odor for 10-15 minutes from the crematory stack.,Air,2022-02-08,2022-02-01,Charles,Incident Closed-Managed,,2022-02-10
1108,1109,69083,Odor/ Fumes are coming into the Westminster Motor Vehicle Administration (MVA) building causing health concerns.,"Air, Fumes, Odor, Open Burning",2022-02-01,2022-02-01,Carroll,Referred to LMA,21157,
1109,1110,69081,Odors/ Fumes coming into the Westminster Motor Vehicle Administration (MVA) are causing health concerns.,"Air, Fumes, Odor, Open Burning",2022-02-01,2022-02-01,Carroll,Referred to LMA,21157,
1110,1111,69080,Smoke,Smoke,2022-02-03,,Garrett,Incident Closed - No further action,21536,2022-04-05
1111,1112,69079,He smells an industrial odor in the residential neighborhood.,Odor,2022-02-02,2022-02-02,Baltimore City,Incident Closed-Managed,,2022-02-03
1112,1113,69078,He smells an industrial odor in the residential neighborhood.,Odor,2022-02-01,2022-02-01,Baltimore City,Incident Closed-Managed,,2022-02-03
1113,1114,69077,He smells an industrial odor in the residential neighborhood.,Odor,2022-01-31,2022-01-31,Baltimore City,Incident Closed-Managed,,2022-02-03
1114,1115,69076,He smells an industrial odor in the residential neighborhood.,Odor,2022-01-30,2022-01-30,Baltimore City,Incident Closed-Managed,,2022-02-03
1115,1116,69073,Black smoke from crematory stack observed for ~ 15 minutes each on both Monday & Tuesday.,Air,2022-02-02,2022-02-02,Charles,Incident Closed-Managed,20695,2022-02-23
1116,1117,69072,He smells an industrial odor in the residential neighborhood.,Odor,2022-01-22,2022-01-22,Baltimore City,Incident Closed-Managed,,2022-02-02
1117,1118,69071,He smells an industrial odor in the residential neighborhood.,Odor,2022-01-09,2022-01-09,Baltimore City,Incident Closed-Managed,,2022-02-02
1118,1119,69067,Smoke from Furnace,Smoke,2022-01-25,,Allegany,Incident Closed-No Violation Observed,21502,2022-03-11
1119,1120,69065,Concerned with health effects of neighbor's fireplace smoke and tobacco smoke.,"Odor, Smoke",2022-01-27,2022-01-27,Montgomery,Referred to Outside Agency,20878,
1120,1121,69063,vehicle emission controls,Air,2022-01-28,2022-01-20,Not Yet Determined,Incident Closed - No further action,,2022-01-21
1121,1122,69062,Dust on road from trucks,Fugitive Dust/Particulate Matter,2022-01-26,2022-01-26,Harford,Incident Closed-No Violation Observed,,2022-01-27
1122,1123,69061,Fumes and odors from an oil company.,Fumes,2022-01-26,2022-01-26,Baltimore,Incident Closed - No further action,21227,2022-02-01
1123,1124,69059,Dust getting on their house and cars from a concrete recycling activity.,Air,2022-01-27,2022-01-26,Frederick,Incident Closed-No Violation Observed,,2022-01-31
1124,1125,69058,Fireplace smoke and odor from neighbors. Also concerned about tobacco smoke from neighboring units coming into the condo.,"Odor, Smoke",2022-01-25,2022-01-25,Montgomery,Referred to Outside Agency,20878,
1125,1126,69052,Neighbor is burning fires,Smoke,2022-01-25,2022-01-25,Baltimore,Referred to Outside Agency,,
1126,1127,69051,Neighbor is burning wood in a shed to keep his cats warm.,Smoke,2022-01-20,2022-01-20,Baltimore,Incident Closed-Managed,,2022-01-25
1127,1128,69049,Odor Complaint,Odor,2021-10-30,2021-10-30,Baltimore City,Incident Closed - No further action,,2021-10-30
1128,1129,69047,Unknown.  Called.  Waiting for response.,Air,2022-01-21,2022-01-20,Not Yet Determined,Under Investigation,,
1129,1130,59045,Mold in Apartment,Other,2022-01-14,2022-01-14,Howard,Referred to Outside Agency,,
1130,1131,59043,Trucks Idling around Cabin branch road,Other,2022-01-19,2022-01-19,Prince George's,Incident Closed-Managed,,2022-01-19
1131,1132,59036,Dust from Sand Blasting Paint,Fugitive Dust/Particulate Matter,2022-01-07,2021-12-20,Washington,Incident Closed-Managed,21742,2022-07-18
1132,1133,59035,Fibers from the heating system in his condo are bothering the complainant.,ARA AQCP non-regulated entity,2022-01-06,2022-01-06,Baltimore,Incident Not Applicable to MDE,,
1133,1134,59030,He smells an industrial odor in the residential neighborhood.,Odor,2022-01-04,2022-01-04,Baltimore City,Incident Closed-Managed,,2022-01-12
1134,1135,59029,He smells an industrial odor in the residential neighborhood.,Odor,2022-01-02,2022-01-02,Baltimore City,Incident Closed-Managed,,2022-01-12
1135,1136,59028,He smells an industrial odor in the residential neighborhood.,Odor,2022-01-01,2022-01-01,Baltimore City,Incident Closed-Managed,,2022-01-12
1136,1137,59027,He smells an industrial odor in the residential neighborhood.,Odor,2021-12-31,2021-12-31,Baltimore City,Incident Closed-Managed,,2022-01-12
1137,1138,59026,She sees X's in  the sky.,Air,2021-12-16,2021-12-16,Baltimore City,Incident Closed - No further action,,2022-01-12
1138,1139,59019,Lead and asbestos at the Baltimore Furniture Bank.,Air,2022-01-07,2022-01-06,Baltimore City,Incident Closed - No further action,,2022-01-07
1139,1140,59016,Numerous concerns regarding the installation of a crematory at Hartzler Funeral Home,Air,2022-01-05,2022-01-05,Carroll,Incident Closed-Managed,21776,2022-01-05
1140,1141,59011,Odor in Home,Odor,2021-12-28,,Washington,Incident Closed - No further action,21795,2021-12-30
1141,1142,59010,illegal tire burning,Other,2021-12-28,2021-12-28,Prince George's,Incident Closed-Managed,20782,2021-12-28
1142,1143,59009,Cloud Of Smoke,Smoke,2021-12-20,2021-12-20,Allegany,Referred to Outside Agency,26726,
1143,1144,59007,Smoke/Odor,Smoke,2021-12-20,2021-12-20,Allegany,Referred to Outside Agency,26726,
1144,1145,59006,Burning plastic.,Air,2021-12-29,2021-12-28,Frederick,Under Investigation,21703,
1145,1146,59005,The caller would like to find a list of Environmental Consultants that would assist with indoor air quality concerns.,Air,2021-12-21,2021-12-21,Montgomery,Incident Closed - No further action,,2021-12-28
1146,1147,59004,Neighbor burning trash in the area,Other,2021-12-22,2021-12-22,Prince George's,Incident Closed-Managed,,2021-12-22
1147,1148,59002,"""Commercial sandblasting on private property next to Tabler Road and a stream.""",Air,2021-12-27,2021-12-21,Frederick,Incident Closed-Managed,,2021-12-28
1148,1149,58995,Odor Complaint,Odor,2021-12-05,2021-12-05,Dorchester,Incident Closed - No further action,21835,2021-12-05
1149,1150,58994,Debris on Road,Other,2021-12-02,,Allegany,Incident Closed-Managed,21502,2022-03-09
1150,1151,58991,Smoke from neighbors smoke stack.,Smoke,2021-12-15,2021-12-15,Harford,Referred to Outside Agency,,
1151,1152,58990,Dust,Air,2021-12-21,2021-12-17,Frederick,Incident Closed-Managed,,2022-01-18
1152,1153,58989,Truckers on complainant's road have hit two of her trees.,Other,2021-12-16,2021-12-16,Harford,Incident Not Applicable to MDE,,
1153,1154,58988,Neighbor is smoking in apartment next door.,Smoke,2021-12-13,2021-12-12,Harford,Referred to Outside Agency,,
1154,1155,58987,Open Burning,Open Burning,2021-12-01,2021-11-07,Washington,Incident Closed-Managed,21742,2022-06-16
1155,1156,58981,Odor around Beachwood Road in Baltimore County,Odor,2021-12-13,2021-12-13,Baltimore,Incident Closed-Managed,21222,2022-01-27
1156,1157,58980,He smells an industrial odor in the residential neighborhood.,Odor,2021-12-04,2021-12-04,Baltimore City,Incident Closed-Managed,,2021-12-15
1157,1158,58979,That a lead and mold inspection needs to be completed at her home.,Lead Paint Poisoning Complaint,2021-12-02,2021-12-02,Baltimore City,Incident Closed - No further action,,2021-12-15
1158,1159,58978,That neighbor is open burning and creating smoke emissions.,Smoke,2021-12-02,2021-12-02,Calvert,Incident Closed - No further action,,2021-12-15
1159,1160,58976,He smells an industrial odor in the residential neighborhood.,Odor,2021-12-01,2021-12-01,Baltimore City,Incident Closed-Managed,,2021-12-15
1160,1161,58975,He smells an industrial odor in the residential neighborhood.,Odor,2021-11-20,2021-11-20,Baltimore City,Incident Closed-Managed,,2021-12-15
1161,1162,58974,That neighbor is renovating exterior of home and creating paint fugitive emissions.,Fugitive Dust/Particulate Matter,2021-09-27,2021-09-27,Baltimore City,Incident Closed - No further action,,2021-12-15
1162,1163,58973,He smells an industrial odor in the residential neighborhood.,Odor,2021-11-18,2021-11-18,Baltimore City,Incident Closed-Managed,,2021-12-15
1163,1164,58972,He smells an industrial odor in the residential neighborhood.,Odor,2021-11-11,2021-11-11,Baltimore City,Incident Closed-Managed,,2021-12-15
1164,1165,58958,Air quality concerns from crushing and screening businesses along Sands Road.,Air,2021-12-08,2021-11-30,Anne Arundel,Under Investigation,,
1165,1166,58939,Odor Complaint,Odor,2021-11-21,2021-11-21,Dorchester,Incident Closed - No further action,21835,2021-11-30
1166,1167,58938,Odor Complaint,Odor,2021-11-30,2021-11-21,Dorchester,Incident Closed - No further action,21835,2021-11-30
1167,1168,58937,Odor Complaint,Odor,2021-11-21,2021-11-21,Dorchester,Incident Closed - No further action,21835,2021-11-21
1168,1169,58936,Odor Complaint,Odor,2021-11-17,2021-11-17,Dorchester,Incident Closed - No further action,21835,2021-11-17
1169,1170,58930,Employees of Target smoking outside of store.,Smoke,2021-11-22,2021-11-22,Baltimore,Incident Not Applicable to MDE,,
1170,1171,58924,complaints from PG citizen,Other,2021-11-18,2021-11-18,Prince George's,Incident Closed-Managed,,2021-11-22
1171,1172,58923,"Air inside Michael and Son Sportsplex in Rockville is poor/ toxic, making people ill.","Air, Odor",2021-11-18,2021-11-02,Montgomery,Referred to Outside Agency,20850,
1172,1173,58912,"Complainant states ""The Plant is spraying hydrogen sulfates acid at 8PM.  Smell it in the air & coming from the ground & sewers.  This is near the Salvation Army on Old Washington RD.""",Air,2021-11-16,2021-11-12,Charles,Incident Closed-No Violation Observed,,2021-11-16
1173,1174,58909,"Pesticides, Possible Health Issues",Other,2021-11-09,,Garrett,Referred to Outside Agency,,
1174,1175,58908,"""Bees Wings"" Corn Dust",Fugitive Dust/Particulate Matter,2021-11-08,,Washington,Incident Closed - No further action,21742,2022-06-21
1175,1176,58907,"""Bees Wings"" Corn Dust",Fugitive Dust/Particulate Matter,2021-11-04,2021-11-04,Washington,Incident Closed - No further action,21742,2022-06-21
1176,1177,58903,Odor Complaint,Odor,2021-11-11,2021-11-11,Dorchester,Incident Closed - No further action,21835,2021-11-11
1177,1178,58902,"Tobacco smoke and odor, as well as harsh detergent fumes, generated by neighbor are coming into the home.","Air, Fumes, Odor, Smoke",2021-11-12,2021-11-12,Montgomery,Referred to Outside Agency,20902,
1178,1179,58901,Odor Complaint,Odor,2021-11-11,2021-11-11,Dorchester,Incident Closed - No further action,21835,2021-11-11
1179,1180,58900,Air quality in Texas area,Air,2021-11-11,2021-11-11,Baltimore,Incident Closed-Managed,,2021-11-12
1180,1181,58899,Indoor air quality in home,Fumes,2021-11-09,2021-11-09,Harford,Incident Closed-Managed,,2021-11-12
1181,1182,58892,He smells an industrial odor in the residential neighborhood.,Odor,2021-11-06,2021-11-06,Baltimore City,Incident Closed-Managed,,2021-11-09
1182,1183,58888,Odors/fumes from the Businesses at 8249 Waterford Road.,Air,2021-11-08,2021-11-07,Anne Arundel,Incident Closed-Managed,21122,2021-11-09
1183,1184,58886,smoking in commercial building.,Other,2021-11-02,2021-11-02,Prince George's,Incident Closed-Managed,,2021-11-05
1184,1185,58885,Mold in Apartment unit,Other,2021-11-01,2021-11-01,Prince George's,Incident Closed-Managed,,2021-11-05
1185,1186,58872,Smoke from burning leaves.  Neighbor's backyard.,Air,2021-10-29,2021-10-27,Anne Arundel,Incident Closed - No further action,,2021-10-27
1186,1187,58869,He observed strong odors on 83.  (LDS 10/26/21),Odor,2021-10-14,2021-10-14,,Incident Closed-Managed,,2021-10-29
1187,1188,58868,He smells an industrial odor in the residential neighborhood.,Odor,2021-10-25,2021-10-25,Baltimore City,Incident Closed-Managed,,2021-10-29
